Datum,Ponovljena,Opstina,Pocetna Cena,Procenjena Vrednost,%,Tip,Kategorija,Opis,Link
2024-07-12,False,Крагујевац - град,28000.0,40000.0,70.0,Pokretnosti,Покретне ствари,регал жуте боје,https://eaukcija.sud.rs/#/aukcije/102166
2024-07-12,False,Крагујевац - град,8400.0,12000.0,70.0,Pokretnosti,Покретне ствари,клуб сто од дрвета,https://eaukcija.sud.rs/#/aukcije/102172
2024-07-12,False,Уб,85708.35,122440.5,70.0,Nepokretnosti,Непокретности,"-	Кат.парц.бр. 880/2 КО Тврдојевац,  површине 6977 м2, шума 2. класе, уписане у лист непокретности број 263 КО Тврдојевац,  са уделом 1/4,",https://eaukcija.sud.rs/#/aukcije/102289
2024-07-12,False,Уб,220249.58,314642.25,70.0,Nepokretnosti,Непокретности,"-	Кат.парц.бр. 880/3 КО Тврдојевац,  површине 12960 м2, од чега њива 2. класе у површини од 8774 м2 и ливада 2. класе у површини од 4186 м2, уписане у лист непокретности број 263 КО Тврдојевац,  са уделом 1/4,",https://eaukcija.sud.rs/#/aukcije/102290
2024-07-12,False,Уб,204790.95,292558.5,70.0,Nepokretnosti,Непокретности,"-	Кат.парц.бр. 953/2 КО Тврдојевац,  површине 12051 м2, њива 4. класе, уписане у лист непокретности број 263 КО Тврдојевац,  са уделом 1/4,",https://eaukcija.sud.rs/#/aukcije/102291
2024-07-12,False,Уб,45782.1,65403.0,70.0,Nepokretnosti,Непокретности,"-	Кат.парц.бр. 958 КО Тврдојевац,  површине 3726 м2, њива 2. класе, уписане у лист непокретности број 263 КО Тврдојевац,  са уделом 1/4,",https://eaukcija.sud.rs/#/aukcije/102294
2024-07-12,False,Уб,132514.2,189306.0,70.0,Nepokretnosti,Непокретности,"-	Кат.парц.бр. 960/1 КО Тврдојевац,  површине 17797 м2, воћњак 2. класе, уписане у лист непокретности број 263 КО Тврдојевац,  са уделом 1/4,",https://eaukcija.sud.rs/#/aukcije/102297
2024-07-12,False,Уб,123013.8,175734.0,70.0,Nepokretnosti,Непокретности,"-	Кат.парц.бр. 960/2 КО Тврдојевац,  површине 7238 м2, од чега њива 4. класе у површини од 7238 м2 и остало вештачки створено неплодно земљиште у површини од 424 м2, уписане у лист непокретности број 263 КО Тврдојевац,  са уделом 1/4,",https://eaukcija.sud.rs/#/aukcije/102300
2024-07-12,False,Уб,112551.08,160787.25,70.0,Nepokretnosti,Непокретности,"-	Кат.парц.бр. 1170/1 КО Тврдојевац,  површине 9162 м2, шума 2.. класе, уписане у лист непокретности број 263 КО Тврдојевац,  са уделом 1/4,",https://eaukcija.sud.rs/#/aukcije/102302
2024-07-12,False,Уб,48873.83,69819.75,70.0,Nepokretnosti,Непокретности,"-	Кат.парц.бр. 961 КО Тврдојевац,  површине 1236 м2, од чега земљиште под зградом и другим објектом у површини од 105 м2, земљиште под зградом и другим објектом у површини од 54 м2, земљиште под зградом и другим објектом у површини од 32 м2, земљиште уз зграду и други објекат у површини од 500 м2 и воћњак 2. класе у површини од 545 м2, уписане у лист непокретности број 263 КО Тврдојевац,  са уделом 1/4,",https://eaukcija.sud.rs/#/aukcije/102304
2024-07-12,False,Уб,238595.18,340850.25,70.0,Nepokretnosti,Непокретности,"-	Породична стамбена зграда на кат.парц. 961 КО Тврдојевац површине 105 м2, објекат изграђен пре доношења прописа о изградњи објекта, уписана у лист непокретности број 263 КО Тврдојевац,  са уделом 1/4,",https://eaukcija.sud.rs/#/aukcije/102307
2024-07-12,False,Уб,77825.48,111179.25,70.0,Nepokretnosti,Непокретности,"-	Помоћна зграда на кат.парц. 961 КО Тврдојевац површине 54 м2, објекат изграђен пре доношења прописа о изградњи објекта, уписана у лист непокретности број 263 КО Тврдојевац,  са уделом 1/4,",https://eaukcija.sud.rs/#/aukcije/102308
2024-07-12,False,Уб,124406.1,177723.0,70.0,Nepokretnosti,Непокретности,"-	Помоћна зграда на кат.парц. 961 КО Тврдојевац површине 32 м2, објекат изграђен пре доношења прописа о изградњи објекта, уписана у лист непокретности број 263 КО Тврдојевац,  са уделом ¼,",https://eaukcija.sud.rs/#/aukcije/102309
2024-07-12,True,Панчево-град,492500.0,985000.0,50.0,Nepokretnosti,Грађевинско земљиште,"Уписана у листу непокретности 3082 КО Банатско Ново Село:
Подаци о парцели:
Број парцеле 1901/0 КО Банатско Ново Село, површина 507m²; потес село, број дела 1; градско
грађевинско земљиште, њива 3. класе
Подаци о парцели:
Број парцеле 1902/0 КО Банатско Ново Село; површина 687m²; потес село, број дела 1; градско
грађевинско земљиште; њива 3. Класе
Напомена: на парцели се налази део објекта који се простире претежно на парцели 1900 КО
Банатско Ново Село и заузима површину од 147m² на парцели 1902/0. Наведени објекат није
предмет извршења.
Парцела 1901/0 и 1902/0 представљају једну целину и тако се продају.
Наведене непокретности представљају једну целину ",https://eaukcija.sud.rs/#/aukcije/102342
2024-07-12,False,Чачак-град,17500.0,25000.0,70.0,Pokretnosti,Покретне ствари,ТВ „ LG “ ,https://eaukcija.sud.rs/#/aukcije/102373
2024-07-12,False,Пожаревац-град,1304898.9,1864141.29,70.0,Nepokretnosti,Пољопривредно земљиште,"кп.бр. 2842, кп.бр. 1510, кп.бр. 1578, кп.бр.1838, кп.бр.1862, кп.бр.1914, кп.бр.2776, кп.бр.2843, кп.бр.1238  све у КО Касидол",https://eaukcija.sud.rs/#/aukcije/102374
2024-07-12,False,Чачак-град,21000.0,30000.0,70.0,Pokretnosti,Покретне ствари,1,https://eaukcija.sud.rs/#/aukcije/102375
2024-07-12,False,Чачак-град,14000.0,20000.0,70.0,Pokretnosti,Покретне ствари,ТВ КОМОДА ДРВО,https://eaukcija.sud.rs/#/aukcije/102376
2024-07-12,False,Чачак-град,10500.0,15000.0,70.0,Pokretnosti,Покретне ствари,МАШИНА ЗА ПРАЊЕ СУДОВА „ GORENJE “ ,https://eaukcija.sud.rs/#/aukcije/102377
2024-07-12,False,Горњи Милановац,24500.0,35000.0,70.0,Pokretnosti,Покретне ствари,ТВ „ SAMSUNG ,https://eaukcija.sud.rs/#/aukcije/102378
2024-07-12,False,Горњи Милановац,21000.0,30000.0,70.0,Pokretnosti,Покретне ствари,-ВЕШ МАШИНА „ GORENJE “ НОВА ,https://eaukcija.sud.rs/#/aukcije/102379
2024-07-12,False,Горњи Милановац,17500.0,25000.0,70.0,Pokretnosti,Покретне ствари,-ХОРИЗОНТАЛИ ЗАМРЗИВАЧ 410 Л„ GORENJE “- ,https://eaukcija.sud.rs/#/aukcije/102380
2024-07-12,False,Горњи Милановац,17500.0,25000.0,70.0,Pokretnosti,Покретне ствари,КУХИЊСКИ ЕЛЕМЕНТИ ,https://eaukcija.sud.rs/#/aukcije/102390
2024-07-12,False,Горњи Милановац,14000.0,20000.0,70.0,Pokretnosti,Покретне ствари,МАШИНА ЗА ПРАЊЕ СУДОВА „ GORENJE “,https://eaukcija.sud.rs/#/aukcije/102391
2024-07-12,True,Крушевац-град,1000.0,2000.0,50.0,Pokretnosti,Покретне ствари,"Соковник марке „GORENJE“, црне боје, обележен идентификационом маркицом  јавног извршитеља АА 124460,   ",https://eaukcija.sud.rs/#/aukcije/102392
2024-07-12,True,Крушевац-град,5000.0,10000.0,50.0,Pokretnosti,Покретне ствари,"Комода дрво – медијапан браон боје, 2 ком. једна комода 2 врата и 6 фиока, друга комода 2 врата, обележен идентификационом маркицом  јавног извршитеља АА 124457,  ",https://eaukcija.sud.rs/#/aukcije/102393
2024-07-12,True,Крушевац-град,6500.0,13000.0,50.0,Pokretnosti,Покретне ствари,"Клима уређај, марке „VOX“, беле боје, обележен идентификационом маркицом  јавног извршитеља АА 124458,  ",https://eaukcija.sud.rs/#/aukcije/102394
2024-07-12,True,Крушевац-град,750.0,1500.0,50.0,Pokretnosti,Покретне ствари,"Сталажа за књиге, дрво – браон боје (мање величине), обележен идентификационом маркицом  јавног извршитеља АА 124461,   ",https://eaukcija.sud.rs/#/aukcije/102395
2024-07-12,True,Крушевац-град,6000.0,12000.0,50.0,Pokretnosti,Покретне ствари,"Кухиња (судопера, радни сто и 1 висећи елемент), иверица браон – беж боје, обележен идентификационом маркицом  јавног извршитеља АА 124459,   ",https://eaukcija.sud.rs/#/aukcije/102396
2024-07-12,False,Петровац на Млави,4029940.54,5757057.91,70.0,Nepokretnosti,Кућа,"кп.бр. 4936 и објекат на истој, кп.бр. 4935 ",https://eaukcija.sud.rs/#/aukcije/102418
2024-07-12,True,Краљево-град,12000.0,24000.0,50.0,Pokretnosti,Разна роба,Клима уређај марке Коперникус,https://eaukcija.sud.rs/#/aukcije/102425
2024-07-12,True,Врњачка Бања,24000.0,48000.0,50.0,Pokretnosti,Разна роба,Клима уређај HISENSE,https://eaukcija.sud.rs/#/aukcije/102426
2024-07-12,True,Лозница-град,4000.0,8000.0,50.0,Pokretnosti,Покретне ствари,кауч,https://eaukcija.sud.rs/#/aukcije/102441
2024-07-12,True,Лозница-град,6000.0,12000.0,50.0,Pokretnosti,Покретне ствари,"LCD Телевизор ""VOX""",https://eaukcija.sud.rs/#/aukcije/102442
2024-07-12,True,Лозница-град,6000.0,12000.0,50.0,Pokretnosti,Покретне ствари,"LCD Телевизор ""VIVAX""",https://eaukcija.sud.rs/#/aukcije/102443
2024-07-12,True,Лозница-град,7500.0,15000.0,50.0,Pokretnosti,Покретне ствари,"веш машина ""GORENJE""",https://eaukcija.sud.rs/#/aukcije/102444
2024-07-12,True,Лозница-град,5000.0,10000.0,50.0,Pokretnosti,Покретне ствари,Комода,https://eaukcija.sud.rs/#/aukcije/102445
2024-07-12,True,Лозница-град,2500.0,5000.0,50.0,Pokretnosti,Покретне ствари,Клуб сто,https://eaukcija.sud.rs/#/aukcije/102446
2024-07-15,False,Врњачка Бања,43540.91,62201.3,70.0,Nepokretnosti,Пољопривредно земљиште,"Катастарска парцела број 693 КО Руђинци, површине 340 м², по врсти пољопривредно земљиште, по култури пашњак 5. класе, у приватној сусвојини извршног дужника са обимом удела од 1/2, уписане у лист непокретности број 1742 КО Руђинци.",https://eaukcija.sud.rs/#/aukcije/101719
2024-07-15,False,Врњачка Бања,296590.43,423700.62,70.0,Nepokretnosti,Пољопривредно земљиште,"Катастарска парцела број 694/2 КО Руђинци, површине 2316 м², по врсти пољопривредно земљиште, по култури њива 4. класе, у приватној сусвојини извршног дужника са обимом удела од 1/2, уписане у лист непокретности број 1742 КО Руђинци.",https://eaukcija.sud.rs/#/aukcije/101720
2024-07-15,False,Врњачка Бања,361773.73,516819.62,70.0,Nepokretnosti,Пољопривредно земљиште,"Катастарска парцела број 695/2 КО Руђинци, површине 2825 м², по врсти пољопривредно земљиште, по култури ливада 5. класе, у приватној сусвојини извршног дужника са обимом удела од 1/2, уписане у лист непокретности број 1742 КО Руђинци.",https://eaukcija.sud.rs/#/aukcije/101722
2024-07-15,False,Врњачка Бања,110006.39,157151.98,70.0,Nepokretnosti,Шумско земљиште,"Катастарска парцела број 697/2 КО Руђинци, површине 951 м², по врсти шумско земљиште, по култури шума 3. класе, у приватној сусвојини извршног дужника са обимом удела од 1/2, уписане у лист непокретности број 1742 КО Руђинци.",https://eaukcija.sud.rs/#/aukcije/101724
2024-07-15,True,Књажевац,7500.0,15000.0,50.0,Pokretnosti,Остала покретна имовина,ТВ ТЕСЛА ,https://eaukcija.sud.rs/#/aukcije/101783
2024-07-15,True,Књажевац,7500.0,15000.0,50.0,Pokretnosti,Остала покретна имовина,Регал у дечјој соби ,https://eaukcija.sud.rs/#/aukcije/101784
2024-07-15,True,Књажевац,5000.0,10000.0,50.0,Pokretnosti,Остала покретна имовина,Веш машина ГОРЕЊЕ ,https://eaukcija.sud.rs/#/aukcije/101785
2024-07-15,False,Нови Бечеј,409906.0,585580.0,70.0,Nepokretnosti,Непокретности,"Тржишна вредност породичне стамбене зграде са припадајућом парцелом КП 1423, у улици Матије Гупца  бр.7, Ново Милошево, све уписано у ЛН 699 КО Ново Милошево у приватној својини извршног дужника Поморишац Ержебет са обимом удела од 1/1, износи  585.580,00 динара.
Датум уписа: 22.07.2003 Врста: ХИПОТЕКА Опис терета: ПРИСП. 2. АВГУСТА 1989 ГОД. ДН. 931/89 НА ОСНОВУ УКЊИЖБЕНЕ ДОЗВОЛЕ ОД 2. АВГУСТА 1989 ГОД. УКЊИЖУЈЕ СЕ ЗАЛОЖНО ПРАВО ДО ИЗНОСА ОД 3.000.000.- ДИН. СЛОВИМА: ТРИМИЛИОНАДИНАРА, ГЛАВНИЦЕ СА ПРИП. НА СТАНБЕНУ ЗГРАДУ А) ЛИСТУ У КОРИСТ: САМОУПРАВНЕ ИНТЕРЕСНЕ ЗАЈЕДНИЦЕ СТАНОВАЊА, НОВИ БЕЧЕЈ.
 Датум уписа: 22.07.2003 Врста: ХИПОТЕКА Опис терета: ПРИСП.16. МАЈА 1991 ГОД. ДН. 429/91 НА ОСНОВУ УКЊИЖБЕНЕ ДОЗВОЛЕ ОД 15. МАЈА 1991. ГОД. УКЊИЖУЈЕ СЕ ЗАЛОЖНО ПРАВО ДО ИЗНОСА ОД 12.000,00. ДИН. СЛОВИМА: ДВАНАЕСТХИЉАДАДИНАРА, ГЛАВНИЦЕ СА ПРИП. НА СТАНБЕНУ ЗГРАДУ А) ЛИСТУ У КОРИСТ: ЈАВНОГ ПРЕДУЗЕЋА ЗА СТАНБЕНЕ УСЛУГЕ, НОВИ БЕЧЕЈ.
",https://eaukcija.sud.rs/#/aukcije/101830
2024-07-15,False,Зрењанин-град,139370.0,199100.0,70.0,Nepokretnosti,Непокретности,"Тржишна вредност стамбене зграда са припадајућом парцелом КП 892 и грађевинска парцела КП 893  у улици Партизанска бр.97, Книћанин, Град Зрењанин, уписано у ЛН 198 КО Книћанин власништво извршног дужника Душан Каранфиловић са уделом од 1/10 , износи 199.100,00 динара.
Датум уписа: 17.03.1986 Врста: ХИПОТЕКА Опис терета: УКЊИЖЕНО ЈЕ ЗАЛОЖНО ПРАВО У ИЗНОСУ ОД 200.000 ДИН.(И СЛОВИМА:ДВЕСТОХИЉАДАДИНАРА) СА 20% ГОД.ИНТ.У КОРИСТ: ВОЈВОЂАНСКА БАНКА ОСНОВНА БАНКА НОВИ САД
",https://eaukcija.sud.rs/#/aukcije/101842
2024-07-15,False,Зрењанин-град,1360879.8,1944114.0,70.0,Nepokretnosti,Пољопривредно земљиште,"Тржишна вредност пољопривредног земљишта њиве 1 класе КП 2144 КО Сакуле- потес Угар,  Општина Опово, уписано у ЛН 2103 КО Сакуле власништво извршног дужника Јована Воденичара са уделом од 1/1, износи  1.944.114,00 динара",https://eaukcija.sud.rs/#/aukcije/101843
2024-07-15,False,Зрењанин-град,1183801.5,1691145.0,70.0,Nepokretnosti,Пољопривредно земљиште,"Тржишна вредност пољопривредног земљишта КП 3100 КО Сакуле- потес Јарне,  Општина Опово, уписано у ЛН 2103 КО Сакуле власништво извршног дужника Јована Воденичара са уделом од 1/1, износи  1.691.145,00 динара",https://eaukcija.sud.rs/#/aukcije/101844
2024-07-15,False,Зрењанин-град,4021070.2,5744386.0,70.0,Nepokretnosti,Непокретности,"Општина: ЗРЕЊАНИН
Катастарска општина: ОРЛОВАТ  Број листа непокретности: 950
895, Површина м2: 629, Улица / Потес: ЂУРЕ ЈАКШИЋА
 Бр.дела парцеле: 1, Површина м2: 629, Начин коришћења земљишта: ЊИВА 3. КЛАСЕ, Врста земљишта: ЗЕМЉИШТЕ У ГРАЂЕВИНСКОМ ПОДРУЧЈУ
 896, Површина м2: 762, Улица / Потес: ЂУРЕ ЈАКШИЋА
 Бр.дела парцеле: 1, Површина м2: 132, Начин коришћења земљишта: ЗЕМЉИШТЕ ПОД ЗГРАДОМ И ДРУГИМ ОБЈЕКТОМ, Врста земљишта: ЗЕМЉИШТЕ У ГРАЂЕВИНСКОМ ПОДРУЧЈУ
 Бр.дела парцеле: 2, Површина м2: 91, Начин коришћења земљишта: ЗЕМЉИШТЕ ПОД ЗГРАДОМ И ДРУГИМ ОБЈЕКТОМ, Врста земљишта: ЗЕМЉИШТЕ У ГРАЂЕВИНСКОМ ПОДРУЧЈУ
 Бр.дела парцеле: 3, Површина м2: 63, Начин коришћења земљишта: ЗЕМЉИШТЕ ПОД ЗГРАДОМ И ДРУГИМ ОБЈЕКТОМ, Врста земљишта: ЗЕМЉИШТЕ У ГРАЂЕВИНСКОМ ПОДРУЧЈУ
 Бр.дела парцеле: 4, Површина м2: 65, Начин коришћења земљишта: ЗЕМЉИШТЕ ПОД ЗГРАДОМ И ДРУГИМ ОБЈЕКТОМ, Врста земљишта: ЗЕМЉИШТЕ У ГРАЂЕВИНСКОМ ПОДРУЧЈУ
 Бр.дела парцеле: 5, Површина м2: 235, Начин коришћења земљишта: ЗЕМЉИШТЕ УЗ ",https://eaukcija.sud.rs/#/aukcije/101845
2024-07-15,False,Нова Црња,61477.5,87825.0,70.0,Nepokretnosti,Непокретности,"Општина: НОВА ЦРЊА
Катастарска општина: ТОБА  Број листа непокретности: 704
 77, Површина м2: 1447, Улица / Потес: КОШУТ ЛАЈОША
 Бр.дела парцеле: 1, Површина м2: 136, Начин коришћења земљишта: ЗЕМЉИШТЕ ПОД ЗГРАДОМ И ДРУГИМ ОБЈЕКТОМ, Врста земљишта: ЗЕМЉИШТЕ У ГРАЂЕВИНСКОМ ПОДРУЧЈУ
 Бр.дела парцеле: 2, Површина м2: 500, Начин коришћења земљишта: ЗЕМЉИШТЕ УЗ ЗГРАДУ И ДРУГИ ОБЈЕКАТ, Врста земљишта: ЗЕМЉИШТЕ У ГРАЂЕВИНСКОМ ПОДРУЧЈУ
 Бр.дела парцеле: 3, Површина м2: 811, Начин коришћења земљишта: ЊИВА 1. КЛАСЕ, Врста земљишта: ЗЕМЉИШТЕ У ГРАЂЕВИНСКОМ ПОДРУЧЈУ
ПОДАЦИ О ЗГРАДАМА И ДРУГИМ ГРАЂЕВИНСКИМ ОБЈЕКТИМА (ОБЈЕКТИ НА ИЗАБРАНОМ ДЕЛУ ПАРЦЕЛЕ)
Улица:			Кућни број:		Површина м2:		Начин коришћења објекта:	
КОШУТ ЛАЈОША	36		136			ПОРОДИЧНА СТАМБЕНА ЗГРАДА	
ОБЈЕКАТ ИЗГРАЂЕН ПРЕ ДОНОШЕЊА ПРОПИСА О ИЗГРАДЊИ ОБЈЕКТА

 власништво извршног дужника, у износу од 87.825,00 динара. 
",https://eaukcija.sud.rs/#/aukcije/101846
2024-07-15,False,Нови Бечеј,188555.5,269365.0,70.0,Nepokretnosti,Непокретности,"Тржишна вредност грађевинске парцеле КП 3022  у улици Петефи Шандора бр.33, Ново Милошево, све уписано у ЛН 1407 КО Ново Милошево у приватној својини извршног дужника Стевица Стојков са обимом удела од 1/1, износи  269.365,00 динара.",https://eaukcija.sud.rs/#/aukcije/101847
2024-07-15,False,Нови Бечеј,155276.1,221823.0,70.0,Nepokretnosti,Непокретности,"Тржишна вредност грађевинске парцеле КП 3023  у улици Петефи Шандора бр.33, Ново Милошево, све уписано у ЛН 1407 КО Ново Милошево у приватној својини извршног дужника Стевица Стојков са обимом удела од 1/1, износи  222.515,00 динара",https://eaukcija.sud.rs/#/aukcije/101848
2024-07-15,False,Краљево-град,119000.0,170000.0,70.0,Pokretnosti,Возило или део возила,"Теретно возило „CITROEN“ JUMPER, жуте боје, година производње 2003, PB 010-BY, регистровано 06.02.2023.",https://eaukcija.sud.rs/#/aukcije/101851
2024-07-15,False,Шабац-град,103277.3,147539.0,70.0,Nepokretnosti,Пољопривредно земљиште,"катастарска парцела број 65/5, потес Главица, укупне површине 29а 35м2, уписана у лист непокретности број 763 КО Букор",https://eaukcija.sud.rs/#/aukcije/101876
2024-07-15,False,Шабац-град,28688.1,40983.0,70.0,Nepokretnosti,Грађевинско земљиште,"катастарска парцела број 1262/1, потес Дивич, површине 17а 05м2, уписана у лист непокретности број 763 КО Букор",https://eaukcija.sud.rs/#/aukcije/101880
2024-07-15,False,Осечина,175000.0,250000.0,70.0,Pokretnosti,Остало возило или део,-	ТРАКТОР „ИМР-РАКОВИЦА“ ТИП „60“ без регистарских ознака,https://eaukcija.sud.rs/#/aukcije/101905
2024-07-15,False,Осечина,70000.0,100000.0,70.0,Pokretnosti,Пољопривредна машина или део,-	ЧЕКРК без ознаке,https://eaukcija.sud.rs/#/aukcije/101906
2024-07-15,False,Осечина,17500.0,25000.0,70.0,Pokretnosti,Пољопривредна опрема или део,"-	ПРСКАЛИЦА, без ознаке, жуте боје",https://eaukcija.sud.rs/#/aukcije/101907
2024-07-15,False,Осечина,8400.0,12000.0,70.0,Pokretnosti,Пољопривредна опрема или део,"-	ТРИМЕР РУЧНИ, без ознаке",https://eaukcija.sud.rs/#/aukcije/101908
2024-07-15,False,Осечина,17500.0,25000.0,70.0,Pokretnosti,Пољопривредна машина или део,"-	РАСТУРИВАЧ ВЕШТАЧКОГ ЂУБРИВА, без ознака зелене боје",https://eaukcija.sud.rs/#/aukcije/101909
