Datum,Ponovljena,Opstina,Pocetna Cena,Procenjena Vrednost,%,Tip,Kategorija,Opis,Link
2025-05-23,False,Ћуприја,5341.75,7631.07,70.0,Nepokretnosti,Пољопривредно земљиште,"Адреса: Ћуприја, Ћуприја
Опис: - њива 2.класе, на кп.бр. 4971, површине 225м2, број дела :1, потес Тоња, која је у своји извршног дужника, са обимом удела 1/2, уписана у ЛН 349 КО Ћуприја( Ван град)
Бр. листа непокретности: 349
Бр. парцеле: 4971
Катастарска општина: КО Ћуприја (Ван град)- пољопривредно земљиште
",https://eaukcija.sud.rs/#/aukcije/131549
2025-05-23,False,Ћуприја,49033.31,70047.59,70.0,Nepokretnosti,Пољопривредно земљиште,"Адреса: Ћуприја, Ћуприја
Опис: - њива 3.класе, на кп.бр. 6946, површине 1549м2, број дела :1, потес Реткар, која је у своји извршног дужника, са обимом удела 2/3, уписана у ЛН 239 КО Ћуприја( Ван град)
Бр. листа непокретности: 239
Бр. парцеле: 6946
Катастарска општина: КО Ћуприја ( Ван град)
",https://eaukcija.sud.rs/#/aukcije/131550
2025-05-23,False,Обреновац,17500.0,25000.0,70.0,Pokretnosti,Канцеларијски намештај,Четворокрилни орман,https://eaukcija.sud.rs/#/aukcije/131897
2025-05-23,False,Обреновац,10500.0,15000.0,70.0,Pokretnosti,Канцеларијски намештај,Тросед од еко коже,https://eaukcija.sud.rs/#/aukcije/131898
2025-05-23,False,Обреновац,8400.0,12000.0,70.0,Pokretnosti,Електронска и рачунарска опрема или део,ЛЦД ТВ марке “FOX” 32,https://eaukcija.sud.rs/#/aukcije/131899
2025-05-23,False,Обреновац,5600.0,8000.0,70.0,Pokretnosti,Канцеларијски намештај,Две фотеље од еко коже,https://eaukcija.sud.rs/#/aukcije/131900
2025-05-23,False,Обреновац,24500.0,35000.0,70.0,Pokretnosti,Канцеларијски намештај,Петокрилни орман,https://eaukcija.sud.rs/#/aukcije/131905
2025-05-23,False,Обреновац,7000.0,10000.0,70.0,Pokretnosti,Електронска и рачунарска опрема или део,ЛЦД ТВ марке “STELLA” 32,https://eaukcija.sud.rs/#/aukcije/131906
2025-05-23,True,Лозница-град,3000.0,6000.0,50.0,Pokretnosti,Покретне ствари,Усисивач марке „ELECTROLUX“,https://eaukcija.sud.rs/#/aukcije/131907
2025-05-23,True,Лозница-град,6000.0,12000.0,50.0,Pokretnosti,Покретне ствари,Уградни шпорет марке „ENEL“,https://eaukcija.sud.rs/#/aukcije/131908
2025-05-23,True,Лозница-град,3000.0,6000.0,50.0,Pokretnosti,Покретне ствари,Микроталасна „SILVERCREST“,https://eaukcija.sud.rs/#/aukcije/131909
2025-05-23,True,Лозница-град,6000.0,12000.0,50.0,Pokretnosti,Покретне ствари,"Телевизор „PANASONIC“, 32 инча",https://eaukcija.sud.rs/#/aukcije/131910
2025-05-23,True,Лозница-град,2500.0,5000.0,50.0,Pokretnosti,Покретне ствари,"Штампач, црни, марке „CANON“",https://eaukcija.sud.rs/#/aukcije/131911
2025-05-23,True,Лозница-град,6000.0,12000.0,50.0,Pokretnosti,Покретне ствари,"Телевизор марке „LG“, 32 инча",https://eaukcija.sud.rs/#/aukcije/131912
2025-05-23,False,Бујановац,28000.0,40000.0,70.0,Pokretnosti,Покретне ствари,"Угаона гарнитура црне боје – ком. 1 – процењена вредност 40.000,00 динара",https://eaukcija.sud.rs/#/aukcije/131919
2025-05-23,False,Бујановац,5600.0,8000.0,70.0,Pokretnosti,Покретне ствари,Сточић мали стаклени,https://eaukcija.sud.rs/#/aukcije/131921
2025-05-23,False,Бујановац,42000.0,60000.0,70.0,Pokretnosti,Покретне ствари,Четвороделни орман (жуте боје) ,https://eaukcija.sud.rs/#/aukcije/131922
2025-05-23,False,Бујановац,10500.0,15000.0,70.0,Pokretnosti,Покретне ствари,Телевизор „LG“ ком. 1 ,https://eaukcija.sud.rs/#/aukcije/131924
2025-05-23,False,Бујановац,8400.0,12000.0,70.0,Pokretnosti,Покретне ствари,Сто кухињски (црне боје ) ,https://eaukcija.sud.rs/#/aukcije/131925
2025-05-23,False,Бујановац,12600.0,18000.0,70.0,Pokretnosti,Покретне ствари,Столице (браон боје – ком. 6 ,https://eaukcija.sud.rs/#/aukcije/131927
2025-05-23,False,Бујановац,8400.0,12000.0,70.0,Pokretnosti,Покретне ствари,Комода за ТВ ( беле боје ) ,https://eaukcija.sud.rs/#/aukcije/131928
2025-05-23,True,Бољевац,80514.0,161028.0,50.0,Nepokretnosti,Шумско земљиште,"805 КО ДОБРО ПОЉЕ - Број парцеле: 5558, Површина парцеле (м2): 1548, Број дела парцеле: 1, Површина дела парцеле (м2): 1548, Култура дела парцеле: Шума 5. класе, Ванкњижна својина: НЕ, Врста права: Својина, Облик својине: Приватна, Обим права: Цело право, Удео: 1/1",https://eaukcija.sud.rs/#/aukcije/131932
2025-05-23,True,Бољевац,358840.0,717680.0,50.0,Nepokretnosti,Остало земљиште,"Број парцеле: 5559, Површина парцеле (м2): 11337, Број дела парцеле: 1, Површина дела парцеле (м2): 2817, Култура дела парцеле: Њива 7. класе, Број дела парцеле: 2, Површина дела парцеле (м2): 2900, Култура дела парцеле: Њива 8. класе, Број дела парцеле: 3, Површина дела парцеле (м2): 5620, Култура дела парцеле: Пашњак 5. класе, Ванкњижна својина: НЕ, Врста права: Својина, Облик својине: Приватна, Обим права: Цело право, Удео: 1/1",https://eaukcija.sud.rs/#/aukcije/131933
2025-05-23,True,Бољевац,312712.0,625424.0,50.0,Nepokretnosti,Остало земљиште,"805 КО ДОБРО ПОЉЕ - Број парцеле: 5554, Површина парцеле (м2): 9166, Број дела парцеле: 1, Површина дела парцеле (м2): 8488, Култура дела парцеле: Њива 8. класе, Број дела парцеле: 2, Површина дела парцеле (м2): 678, Култура дела парцеле: Шума 5. класе, Ванкњижна својина: НЕ, Врста права: Својина, Облик својине: Приватна, Обим права: Цело право, Удео: 1/1",https://eaukcija.sud.rs/#/aukcije/131934
2025-05-23,True,Бољевац,67478.0,134956.0,50.0,Nepokretnosti,Шумско земљиште,"805 ДОБРО ПОЉЕ - Број парцеле: 5555, Површина парцеле (м2): 1172, Број дела парцеле: 1, Површина дела парцеле (м2): 1172, Култура дела парцеле: Шума 5. класе, Ванкњижна својина: НЕ, Врста права: Својина, Облик својине: Приватна, Обим права: Цело право, Удео: 1/1",https://eaukcija.sud.rs/#/aukcije/131935
2025-05-23,True,Бољевац,109706.0,219412.0,50.0,Nepokretnosti,Остало земљиште,"805 КО ДОБРО ПОЉЕ - Број парцеле: 5556, Површина парцеле (м2): 3466, Број дела парцеле: 1, Површина дела парцеле (м2): 3466, Култура дела парцеле: Ливада 6. класе, Ванкњижна својина: НЕ, Врста права: Својина, Облик својине: Приватна, Обим права: Цело право, Удео: 1/1",https://eaukcija.sud.rs/#/aukcije/131936
2025-05-23,True,Бољевац,73203.0,146406.0,50.0,Nepokretnosti,Шумско земљиште,"805 КО ДОБРО ПОЉЕ - Број парцеле: 5557, Површина парцеле (м2): 1401, Број дела парцеле: 1, Површина дела парцеле (м2): 1401, Култура дела парцеле: Шума 5. класе, Ванкњижна својина: НЕ, Врста права: Својина, Облик својине: Приватна, Обим права: Цело право, Удео: 1/1",https://eaukcija.sud.rs/#/aukcije/131937
2025-05-23,True,Владимирци,222685.13,445370.26,50.0,Nepokretnosti,Пољопривредно земљиште,"- катастарска парцела број 355/4, потес Дуга мала, површине 83а 50м2, уписана у лист непокретности број 268 КО Козарица, у својини извршног дужника 1/1 ( по налазу и мишљењу вештака на парцели је ливада; парцела је у благом нагибу и нема добар приступ) ",https://eaukcija.sud.rs/#/aukcije/131941
2025-05-23,True,Владимирци,87902.02,175804.05,50.0,Nepokretnosti,Шумско земљиште,"- катастарска парцела број 123/2, потес Дуга мала, површине 32а 84м2, уписана у лист непокретности број 268 КО Козарица, у својини извршног дужника 1/1",https://eaukcija.sud.rs/#/aukcije/131942
2025-05-23,True,Владимирци,216825.0,433650.0,50.0,Nepokretnosti,Пољопривредно земљиште,"- катастарска парцела број 386/2, потес Дуга мала, површине 82а 66м2, уписана у лист непокретности број 268 КО Козарица, у својини извршног дужника 1/1 ( по налазу и мишљењу вештака на парцели је ливада и има добар приступ) ",https://eaukcija.sud.rs/#/aukcije/131943
2025-05-23,True,Бољевац,1646260.0,3292520.0,50.0,Nepokretnosti,Шумско земљиште,"1104 КО ЈАБЛАНИЦА-  КОЊСКИ ПАД, Општина: БОЉЕВАЦ, КО: ЈАБЛАНИЦА, Број листа непокретности: 1104, Број парцеле: 3195, Површина парцеле (м2): 82312, Број дела парцеле: 1, Површина дела парцеле (м2): 82312, Култура дела парцеле: Шума 6. класе, Ванкњижна својина: НЕ, Врста права: Својина, Облик својине: Приватна, Обим права: Цело право, Удео: 1/1",https://eaukcija.sud.rs/#/aukcije/131947
2025-05-23,False,Алексинац,21000.0,30000.0,70.0,Pokretnosti,Покретне ствари,види слику,https://eaukcija.sud.rs/#/aukcije/131960
2025-05-23,False,Алексинац,4200.0,6000.0,70.0,Pokretnosti,Покретне ствари,види слику,https://eaukcija.sud.rs/#/aukcije/131962
2025-05-23,True,Краљево-град,3000.0,6000.0,50.0,Pokretnosti,Намештај,дрвена полица за ТВ,https://eaukcija.sud.rs/#/aukcije/131966
2025-05-23,True,Краљево-град,3500.0,7000.0,50.0,Pokretnosti,Намештај,"дрвена витрина, браон боје",https://eaukcija.sud.rs/#/aukcije/131967
2025-05-23,True,Краљево-град,7500.0,15000.0,50.0,Pokretnosti,Разна роба,"плазма марке ""PANASONIC"" 35 инча",https://eaukcija.sud.rs/#/aukcije/131968
2025-05-23,True,Краљево-град,6000.0,12000.0,50.0,Pokretnosti,Разна роба,"марке ""ARDO""",https://eaukcija.sud.rs/#/aukcije/131969
2025-05-23,False,Алексинац,21000.0,30000.0,70.0,Pokretnosti,Покретне ствари,види слику,https://eaukcija.sud.rs/#/aukcije/131973
2025-05-23,False,Алексинац,14000.0,20000.0,70.0,Pokretnosti,Покретне ствари,види слику,https://eaukcija.sud.rs/#/aukcije/131974
2025-05-23,False,Алексинац,8400.0,12000.0,70.0,Pokretnosti,Покретне ствари,види слику,https://eaukcija.sud.rs/#/aukcije/131975
2025-05-23,False,Алексинац,10500.0,15000.0,70.0,Pokretnosti,Покретне ствари,види слику,https://eaukcija.sud.rs/#/aukcije/131976
2025-05-23,False,Алексинац,35000.0,50000.0,70.0,Pokretnosti,Покретне ствари,види слику,https://eaukcija.sud.rs/#/aukcije/131977
2025-05-23,False,Алексинац,10500.0,15000.0,70.0,Pokretnosti,Покретне ствари,види слику,https://eaukcija.sud.rs/#/aukcije/131978
2025-05-23,False,Алексинац,10500.0,15000.0,70.0,Pokretnosti,Покретне ствари,види слику,https://eaukcija.sud.rs/#/aukcije/131979
2025-05-23,False,Мајданпек,1257487.98,1796411.4,70.0,Nepokretnosti,Непокретности,"- кп.бр. 4339/2, КО Тополница,помоћна зграда, број објекта 1, површина 110 метра квадратних, уписана у лист непокретности 551 

- кп.бр. 4339/2, КО Тополница,број дела 1, земљиште под зградом и другим објектом , површине 110 метра квадратних, уписана у лист непокретности 551 

- кп.бр. 4339/2, КО Тополница, број дела 2, њива 4. класе, површине 470 метра квадратних, уписана у лист непокретности 551
",https://eaukcija.sud.rs/#/aukcije/131981
2025-05-23,False,Врбас,35000.0,50000.0,70.0,Pokretnosti,Угоститељска опрема или део,„TEPRO“ роштиљ,https://eaukcija.sud.rs/#/aukcije/131986
2025-05-23,False,Врбас,21000.0,30000.0,70.0,Pokretnosti,Угоститељска опрема или део,Баштенски двосед,https://eaukcija.sud.rs/#/aukcije/131987
2025-05-23,False,Врбас,28000.0,40000.0,70.0,Pokretnosti,Електронска и рачунарска опрема или део,„SAMSUNG“ телевизор,https://eaukcija.sud.rs/#/aukcije/131993
2025-05-23,False,Врбас,24500.0,35000.0,70.0,Pokretnosti,Намештај,"Клуб сто, беле боје, са стакленом површином",https://eaukcija.sud.rs/#/aukcije/131994
2025-05-23,False,Чачак-град,112000.0,160000.0,70.0,Pokretnosti,Возило или део возила,"FIAT PANDA ČA175-PM , произведен 2005.",https://eaukcija.sud.rs/#/aukcije/132014
2025-05-23,False,Чукарица,49000.0,70000.0,70.0,Pokretnosti,Покретне ствари,"Телевизор ""Озон"" 55"" - неиспитан, Број холограмске маркице: АА 157082",https://eaukcija.sud.rs/#/aukcije/132027
2025-05-23,False,Чукарица,28000.0,40000.0,70.0,Pokretnosti,Покретне ствари,"Телевизор ""VOX"" 40"", Број холограмске маркице: AA 157083",https://eaukcija.sud.rs/#/aukcije/132028
2025-05-23,False,Чукарица,21000.0,30000.0,70.0,Pokretnosti,Покретне ствари,"Телевизор ""VOX"" 32"", Број холограмске маркице: AA 157084",https://eaukcija.sud.rs/#/aukcije/132029
2025-05-23,False,Чукарица,14000.0,20000.0,70.0,Pokretnosti,Покретне ствари,"Штампач ""EPSON"" L3060 - неиспитан, Број холограмске маркице: АА 157085",https://eaukcija.sud.rs/#/aukcije/132030
2025-05-23,False,Чукарица,10500.0,15000.0,70.0,Pokretnosti,Покретне ствари,"Штампач ""EPSON"" L 3251 - неиспитан, Број холограмске маркице: АА157086",https://eaukcija.sud.rs/#/aukcije/132031
2025-05-23,False,Чукарица,8400.0,12000.0,70.0,Pokretnosti,Покретне ствари,"Монитор ""DELL"" - неиспитан, Број холограмске маркице: АА 157087",https://eaukcija.sud.rs/#/aukcije/132032
2025-05-23,False,Бољевац,4508816.2,6441166.0,70.0,Nepokretnosti,Непокретности,"-   КП. 758 КО ВАЛАКОЊЕ  , Површина м2: 3080  ,   са објектом ,    Објекат бр. 1 на КП. 758 КО ВАЛАКОЊЕ   , уписана  Површина м2: 115 , породична стамбена зграда , објекат изграђен пре доношења прописа о изградњи објекта.  Измерена површина објекта износи 171 м2.",https://eaukcija.sud.rs/#/aukcije/132033
2025-05-23,True,Бојник,2500.0,5000.0,50.0,Pokretnosti,Намештај,Двосед беле боје са оштећењем,https://eaukcija.sud.rs/#/aukcije/132059
2025-05-23,True,Бојник,3500.0,7000.0,50.0,Pokretnosti,Електронска и рачунарска опрема или део,Вуфер PB – већи,https://eaukcija.sud.rs/#/aukcije/132060
2025-05-23,True,Бојник,5000.0,10000.0,50.0,Pokretnosti,Електронска и рачунарска опрема или део,Лап топ dell insprion – црне боје,https://eaukcija.sud.rs/#/aukcije/132061
2025-05-23,True,Бојник,2000.0,4000.0,50.0,Pokretnosti,Намештај,Сточић беле боје са оштећењем,https://eaukcija.sud.rs/#/aukcije/132062
2025-05-23,True,Бојник,2500.0,5000.0,50.0,Pokretnosti,Покретне ствари,Телевизор Bluberry – 32”,https://eaukcija.sud.rs/#/aukcije/132063
2025-05-23,False,Сечањ,655585.0,936550.0,70.0,Nepokretnosti,Непокретности,"ПОРОДИЧНА СТАМБЕНА ЗГРАДА, са припадајућим објектима, парцела кп 1784 површине  663м2 и 1785 површине 743 м2 КО Јаша Томић, у улици ЈНА број 62, Јаша Томић, све уписано у ЛН  612 КО Јаша Томић, ",https://eaukcija.sud.rs/#/aukcije/132064
2025-05-23,False,Крагујевац - град,115792.86,165418.37,70.0,Nepokretnosti,Пољопривредно земљиште,"кп.бр. 3228,  укупне површине 3227м2  и то број дела 1,  која се води као њива V класе, површине 2227 м2 ,  као пољопривредно земљиште; број дела 2, која се води као шума V класе, као пољопривредно земљиште, површине 1000 м2 ,  потес / улица Главица са кршем , уписана у лн.бр. 129 КО Рамаћа",https://eaukcija.sud.rs/#/aukcije/132065
2025-05-23,False,Крагујевац - град,90807.49,129724.98,70.0,Nepokretnosti,Шумско земљиште,"кп.бр. 3222, површине 3695 м2 , број дела 1, која се води као шума V класе, као шумско земљиште, потес /улица Главица са кршем , уписана у лн.бр. 129 КО Рамаћа",https://eaukcija.sud.rs/#/aukcije/132066
2025-05-23,False,Крагујевац - град,52690.46,75272.09,70.0,Nepokretnosti,Шумско земљиште,"кп.бр. 3105/6, површине 2144 м2 , број дела 1, која се води као шума V класе, као шумско земљиште, потес/ улица Лакочеве ливаде ",https://eaukcija.sud.rs/#/aukcije/132067
2025-05-23,False,Крагујевац - град,446992.39,638560.55,70.0,Nepokretnosti,Грађевинско земљиште,"кп.бр. 3104/2, укупне површине 1559 м2 , и то број дела 1, која се води као земљиште под зградом и другим објектом, површине 49 м2 , као грађевинско земљиште изван грађевинског подручја, број дела 2, која се води као земљиште уз зграду и други објекат, површине 500 м2 , као грађевинско земљиште изван грађевинског подручја, број дела 3, која се води као воћњак IV класе, површине 1010 м2 , као грађевинско земљиште изван грађевинског подручја, потес/ улица Лакочеве ливаде, уписана у лн.бр. 129 КО Рамаћа",https://eaukcija.sud.rs/#/aukcije/132068
2025-05-23,False,Крагујевац - град,109648.92,156641.31,70.0,Nepokretnosti,Пољопривредно земљиште,"кп.бр.2616, површине 2677 м2 , број дела 1, која се води као њива V класе, као пољопривредно земљиште, потес / улица Главица са кршем , уписана у лн.бр.129 КО Рамаћа",https://eaukcija.sud.rs/#/aukcije/132069
2025-05-23,False,Крагујевац - град,53722.64,76746.63,70.0,Nepokretnosti,Шумско земљиште,"кп.бр. 2547/4, површине 2186 м2 , број дела 1, која се води као шума V класе, као шумско земљиште, потес / улица Главица са кршем , уписана у лн.бр. 129 КО Рамаћа",https://eaukcija.sud.rs/#/aukcije/132070
2025-05-23,True,Лозница-град,3000.0,6000.0,50.0,Pokretnosti,Покретне ствари,"Две металне столице, сиве боје, са наслоном",https://eaukcija.sud.rs/#/aukcije/132071
2025-05-23,True,Лозница-град,5000.0,10000.0,50.0,Pokretnosti,Покретне ствари,"Трпезаријски сто, боје букве",https://eaukcija.sud.rs/#/aukcije/132072
2025-05-23,True,Лозница-град,3500.0,7000.0,50.0,Pokretnosti,Покретне ствари,Термоакумулациона пећ сиве боје,https://eaukcija.sud.rs/#/aukcije/132073
2025-05-23,True,Лозница-град,7000.0,14000.0,50.0,Pokretnosti,Покретне ствари,"Телевизор плазма „LG“, 100cm дијагонала",https://eaukcija.sud.rs/#/aukcije/132074
2025-05-23,True,Лозница-град,5000.0,10000.0,50.0,Pokretnosti,Покретне ствари,"Замрзивач беле боје са браон поклопцем, 410L",https://eaukcija.sud.rs/#/aukcije/132075
2025-05-23,True,Лозница-град,8000.0,16000.0,50.0,Pokretnosti,Покретне ствари,"Моторна тестера „VILLAGER“, наранџасте боје",https://eaukcija.sud.rs/#/aukcije/132076
2025-05-23,True,Лозница-град,3000.0,6000.0,50.0,Pokretnosti,Покретне ствари,"Судопера боје букве, једноделна",https://eaukcija.sud.rs/#/aukcije/132077
2025-05-23,True,Лозница-град,5000.0,10000.0,50.0,Pokretnosti,Покретне ствари,"Расхладна витрина плаве боје, непознате марке",https://eaukcija.sud.rs/#/aukcije/132078
2025-05-23,True,Лозница-град,2000.0,4000.0,50.0,Pokretnosti,Покретне ствари,"Двокрилни шифоњер, трула вишња боје",https://eaukcija.sud.rs/#/aukcije/132079
2025-05-23,True,Лозница-град,7000.0,14000.0,50.0,Pokretnosti,Покретне ствари,"Веш машина „WHIRLPOOL“, беле боје",https://eaukcija.sud.rs/#/aukcije/132080
2025-05-23,False,Крагујевац - град,34791.11,49701.58,70.0,Nepokretnosti,Пољопривредно земљиште,"кп.бр. 2414, површине 611 м2 , број дела 1, која се води као воћњак IV класе, као пољопривредно земљиште, потес / улица Ивље , уписана у лн.бр. 129 КО Рамаћа",https://eaukcija.sud.rs/#/aukcije/132081
2025-05-23,True,Бољевац,220310.0,440620.0,50.0,Nepokretnosti,Непокретности," КП . 193 КО ЛУКОВО , Површина м2: 5190 Начин коришћења земљишта: ШУМА 6. КЛАСЕ, Врста земљишта: ШУМСКО ЗЕМЉИШТЕ",https://eaukcija.sud.rs/#/aukcije/132082
2025-05-23,False,Крагујевац - град,24616.73,35166.76,70.0,Nepokretnosti,Пољопривредно земљиште,"кп.бр. 1994, површине 601 м2 , број дела 1, која се води као њива V класе, као пољопривредно земљиште, потес / улица Пауновић , уписана у лн.бр. 129 КО Рамаћа",https://eaukcija.sud.rs/#/aukcije/132083
2025-05-23,True,Бољевац,109886.5,219773.0,50.0,Nepokretnosti,Непокретности,"194 КО ЛУКОВО , Површина м2: 3681,  Начин коришћења земљишта: ЊИВА 7. КЛАСЕ, Врста земљишта: ПОЉОПРИВРЕДНО ЗЕМЉИШТЕ",https://eaukcija.sud.rs/#/aukcije/132084
