Datum,Ponovljena,Opstina,Pocetna Cena,Procenjena Vrednost,%,Tip,Kategorija,Opis,Link
2025-05-27,False,Шид,140398.02,200568.6,70.0,Pokretnosti,Возило или део возила,VOLKSVAGEN  VW GOLF 2008. ,https://eaukcija.sud.rs/#/aukcije/132687
2025-05-27,False,Шид,707528.85,1010755.5,70.0,Pokretnosti,Транспортно возило или део,"TERETNO VOZILO MAN TGA 2006.
18440 4X2 BLS BELA BOJA  DIZEL",https://eaukcija.sud.rs/#/aukcije/132688
2025-05-27,False,Шид,175165.76,250236.8,70.0,Pokretnosti,Возило или део возила,"VOLKSVAGEN PASSAT 2001.DIZEL
",https://eaukcija.sud.rs/#/aukcije/132689
2025-05-27,False,Шид,2100.0,3000.0,70.0,Pokretnosti,Разна роба,TRGOVAČKA POLICA ZA ROBU -DVOSTRANI RAF - BR.1,https://eaukcija.sud.rs/#/aukcije/132690
2025-05-27,False,Шид,2100.0,3000.0,70.0,Pokretnosti,Разна роба,TRGOVAČKA POLICA ZA ROBU -DVOSTRANI RAF BR.2,https://eaukcija.sud.rs/#/aukcije/132691
2025-05-27,False,Шид,2100.0,3000.0,70.0,Pokretnosti,Разна роба,TRGOVAČKA POLICA ZA ROBU -DVOSTRANI RAF BR.3,https://eaukcija.sud.rs/#/aukcije/132692
2025-05-27,False,Шид,2100.0,3000.0,70.0,Pokretnosti,Разна роба,ZIDNI RAF  TRGOVAČKA POLICA -DUPLI ,https://eaukcija.sud.rs/#/aukcije/132693
2025-05-27,False,Шид,4900.0,7000.0,70.0,Pokretnosti,Разна роба,ZIDNI RAF TRGOVAČKA POLICA -SEDMODELNI ,https://eaukcija.sud.rs/#/aukcije/132694
2025-05-27,False,Шид,4900.0,7000.0,70.0,Pokretnosti,Разна роба,KLIMA UREĐAJ LG  S18AH,https://eaukcija.sud.rs/#/aukcije/132695
2025-05-27,False,Шид,4900.0,7000.0,70.0,Pokretnosti,Разна роба,KLIMA UREĐAJ LG  JET COOL ,https://eaukcija.sud.rs/#/aukcije/132696
2025-05-27,False,Шид,2800.0,4000.0,70.0,Pokretnosti,Разна роба,ZIDNI RAF TRGOVAČKA POLICA -TRODELNI ,https://eaukcija.sud.rs/#/aukcije/132697
2025-05-27,False,Шид,10500.0,15000.0,70.0,Pokretnosti,Разна роба,SUDOPERA SA RADNIM DELOM I POLICAMA ,https://eaukcija.sud.rs/#/aukcije/132698
2025-05-27,False,Нови Сад - град,646608.0,646608.0,100.0,Nepokretnosti,Стан,"стан број 7, број објекта 1, уписане корисне површине 1 м2, у приземљу, једна соба, катастарска парцела 9549, КО Нови Сад 1, на адреси Скерлићева број 4, Нови Сад, у својини извршног дужника 1/1",https://eaukcija.sud.rs/#/aukcije/132699
2025-05-27,True,Нови Пазар-град,30000.0,60000.0,50.0,Pokretnosti,Разна роба,"„POJASARKA“,  ",https://eaukcija.sud.rs/#/aukcije/132713
2025-05-27,True,Нови Пазар-град,75000.0,150000.0,50.0,Pokretnosti,Разна роба,"„RUPIČARKA“, ",https://eaukcija.sud.rs/#/aukcije/132714
2025-05-27,True,Нови Пазар-град,50000.0,100000.0,50.0,Pokretnosti,Разна роба,„LATERICA“ ,https://eaukcija.sud.rs/#/aukcije/132715
2025-05-27,True,Нови Пазар-град,20000.0,40000.0,50.0,Pokretnosti,Разна роба,„GAJKARA“ ,https://eaukcija.sud.rs/#/aukcije/132716
2025-05-27,True,Нови Пазар-град,75000.0,150000.0,50.0,Pokretnosti,Путничко возило или део,"„VOLKSWAGEN“ PASSAT B, металик сива боја,  година производње 1999., истекла регистрација, регистарске ознаке NP 043-UD стање – половно",https://eaukcija.sud.rs/#/aukcije/132717
2025-05-27,True,Нови Пазар-град,45000.0,90000.0,50.0,Pokretnosti,Разна роба,„STEP“ ,https://eaukcija.sud.rs/#/aukcije/132718
2025-05-27,True,Нови Пазар-град,15000.0,30000.0,50.0,Pokretnosti,Разна роба,„REPID“,https://eaukcija.sud.rs/#/aukcije/132719
2025-05-27,True,Нови Пазар-град,20000.0,40000.0,50.0,Pokretnosti,Разна роба,"„RINGLIČARKA“, ",https://eaukcija.sud.rs/#/aukcije/132720
2025-05-27,True,Нови Пазар-град,25000.0,50000.0,50.0,Pokretnosti,Разна роба,"„ENGLARICA“, ",https://eaukcija.sud.rs/#/aukcije/132721
2025-05-27,False,Лесковац-град,315000.0,450000.0,70.0,Pokretnosti,Путничко возило или део,"Путничко моторно возило, марке “MINI COOPER”, боја возила E CRNA M, број шасије WMWRE3104TD30831, радна запремина мотора 1598; снага мотора. 125, Бензински мотора, број мотора W11B16AAD285S134, година произвиње 2004, регистраске ознаке VL 036-JZ, која регистрација на возилу је истекла и саобраћајна дозвола је изгубљена,",https://eaukcija.sud.rs/#/aukcije/132726
2025-05-28,False,Зрењанин-град,2213176.0,3161680.0,70.0,Nepokretnosti,Непокретности,"Породична стамбена зграда са припадајућом парцелом  КП 2531/20  К.О. Словачки Арадац, уписане у ЛН 760  у улици Димитрија Мите Ђорђевића 18,  Арадац, Град Зрењанин",https://eaukcija.sud.rs/#/aukcije/132357
2025-05-28,False,Лучани,39678.8,56684.0,70.0,Nepokretnosti,Шумско земљиште,"кат. парцела број 1096, површине 1209m², шума 3. класе, Молитва, листа непокретности број 11 КО Граб, 1/1 удела непокретности",https://eaukcija.sud.rs/#/aukcije/132434
2025-05-28,False,Лучани,178882.2,255546.0,70.0,Nepokretnosti,Пољопривредно земљиште,"кат. парцела број 1246/1, површине 5456m², њива 6. класе, Скејиновац, листа непокретности број 11 КО Граб, 1/1 удела непокретности",https://eaukcija.sud.rs/#/aukcije/132435
2025-05-28,False,Лучани,37383.5,53405.0,70.0,Nepokretnosti,Шумско земљиште,"кат. парцела број 1246/2, површине 1139m², шума 3. класе, Скејиновац, листа непокретности број 11 КО Граб, 1/1 удела непокретности",https://eaukcija.sud.rs/#/aukcije/132436
2025-05-28,False,Лучани,26807.9,38297.0,70.0,Nepokretnosti,Шумско земљиште,"кат. парцела број 1246/3, површине 933m², шума 4. класе, Скејиновац, листа непокретности број 11 КО Граб, 1/1 удела непокретности",https://eaukcija.sud.rs/#/aukcije/132437
2025-05-28,False,Лучани,13526.8,19324.0,70.0,Nepokretnosti,Шумско земљиште,"кат. парцела број 1468/2, површине 473m², шума 2. класе, Молитва, листа непокретности број 11 КО Граб, 1/1 удела непокретности",https://eaukcija.sud.rs/#/aukcije/132438
2025-05-28,False,Лучани,395147.9,564497.0,70.0,Nepokretnosti,Пољопривредно земљиште,"кат. парцела број 1477/1, површине 13771m², њива 5. класе, Поље, листа непокретности број 11 КО Граб, 1/1 удела непокретности",https://eaukcija.sud.rs/#/aukcije/132439
2025-05-28,False,Лучани,106903.3,152719.0,70.0,Nepokretnosti,Пољопривредно земљиште,"кат. парцела број 1477/6, површине 3259m², њива 5. класе, Молитва, листа непокретности број 11 КО Граб, 1/1 удела непокретности",https://eaukcija.sud.rs/#/aukcije/132440
2025-05-28,False,Лучани,545172.6,778818.0,70.0,Nepokretnosti,Пољопривредно земљиште,"кат. парцела број 1507, површине 16624m², ливада 5. класе, Молитва, листа непокретности број 11 КО Граб, 1/1 удела непокретности",https://eaukcija.sud.rs/#/aukcije/132441
2025-05-28,False,Лучани,247418.5,353455.0,70.0,Nepokretnosti,Пољопривредно земљиште,"кат. парцела број 1582/2, површине 5487m², ливада 6. класе, Ђуровски до, листа непокретности број 610 КО Граб, 1/1 удела непокретности",https://eaukcija.sud.rs/#/aukcije/132446
2025-05-28,False,Лучани,26152.0,37360.0,70.0,Nepokretnosti,Шумско земљиште,"кат. парцела број 1583/2, површине 912m², шума 3. класе, Ђуровски до, листа непокретности број 610 КО Граб, 1/1 удела непокретности",https://eaukcija.sud.rs/#/aukcije/132448
2025-05-28,False,Лучани,37219.0,53170.0,70.0,Nepokretnosti,Шумско земљиште,"кат. парцела број 1704, површине 1136m², шума 3. класе, Ђуровски до, листа непокретности број 11 КО Граб, 1/1 удела непокретности",https://eaukcija.sud.rs/#/aukcije/132449
2025-05-28,False,Лучани,848829.8,1212614.0,70.0,Nepokretnosti,Остали пољопривредни објекат,"кат. парцела број 1698, укупне површине 8629m², а која се састоји од земљишта под зградом и другим објектом, број 1, површине 104m², земљишта под зградом и другим објектом, број 2, површине 96m² и пашњака 4. класе, површине 8429m², као и зграда пољопривреде, број 1, површине у основи 104m² и зграда пољопривреде, број 2, површине у основи 96m², обе постојеће на истој парцели, Ђуровски до, све према листу непокретности број 11 КО Граб, 1/1 удела непокретности",https://eaukcija.sud.rs/#/aukcije/132450
2025-05-28,False,Лучани,39060.0,55800.0,70.0,Nepokretnosti,Остали пољопривредни објекат,"зграда пољопривреде, број 1, површине у основи 93m², постојећа на кат. парцели број 1700, Ђуровски до, све према листу непокретности број 742 КО Граб, 1/1 удела непокретности",https://eaukcija.sud.rs/#/aukcije/132451
2025-05-28,False,Нови Београд,14763848.4,21091212.0,70.0,Nepokretnosti,Стан,"ТРОСОБАН СТАН 94 М2, ЉУБИНКЕ БОБИЋ 13/3 НОВИ БЕОГРАД",https://eaukcija.sud.rs/#/aukcije/132455
2025-05-28,False,Крагујевац - град,5600.0,8000.0,70.0,Pokretnosti,Покретне ствари,1.	Машина за прање судова VOX,https://eaukcija.sud.rs/#/aukcije/132531
2025-05-28,False,Крагујевац - град,8400.0,12000.0,70.0,Pokretnosti,Покретне ствари,2.	Замрзива сандуар од 410L GORENJE,https://eaukcija.sud.rs/#/aukcije/132532
2025-05-28,False,Крагујевац - град,2800.0,4000.0,70.0,Pokretnosti,Покретне ствари,3.	ТВ марке TESLA,https://eaukcija.sud.rs/#/aukcije/132533
2025-05-28,False,Крагујевац - град,3500.0,5000.0,70.0,Pokretnosti,Покретне ствари,4.	ТВ марке LG,https://eaukcija.sud.rs/#/aukcije/132534
2025-05-28,False,Крагујевац - град,8400.0,12000.0,70.0,Pokretnosti,Покретне ствари,5.	Справа за вежбање-бицикла,https://eaukcija.sud.rs/#/aukcije/132535
2025-05-28,False,Крагујевац - град,9100.0,13000.0,70.0,Pokretnosti,Покретне ствари,6.	Справа за вежбање-нордиско скијање,https://eaukcija.sud.rs/#/aukcije/132536
2025-05-28,False,Крагујевац - град,8400.0,12000.0,70.0,Pokretnosti,Покретне ствари,"7.	Угаона гарнитура(двосед,тросед) мебл",https://eaukcija.sud.rs/#/aukcije/132537
2025-05-28,False,Крагујевац - град,70000.0,100000.0,70.0,Pokretnosti,Покретне ствари,8.	Дрвена грађа-талпе 5X12X4 3m кубна,https://eaukcija.sud.rs/#/aukcije/132539
2025-05-28,True,Сечањ,1754295.0,3508590.0,50.0,Nepokretnosti,Парцела,"целе непокретности у сувласништву странака уписанe у листу непокретности број 282 К.О. Јаша Томић, парц. бр. 1457 улица Маршала Тита њива 1. класе површине 06а 83м2, парц. бр. 1458 ул. Маршала Тита 48, земљиште под зградом и другим објектом површине 02а 31м2 на којој је истакута породична стамбена зграда број објекта 1 ПР1 обејкат преузет из земљишне књиге ул. Маршала Тита 48 земљиште уз зграду и други објекат површине 05а 00м2, њива 1. класе површине 01а 95м2, на парц. бр. 1458 у природи се налазе два неистакнута објекта и то објекат број 1 који чини приземље, 1 спрат и таван и има укупну корисну површину од 169,58м2 изграђен 1973 године и обејкат број 2  који чини приземље 1 спрат и таван и има укупну корисну површину од 188,07м2 изграђен 1983 године.",https://eaukcija.sud.rs/#/aukcije/132543
2025-05-28,False,Тутин,4284508.43,6120726.33,70.0,Nepokretnosti,Грађевинско земљиште,"Остало вештачки створено неплодно земљиште, грађевинско земљиште изван 	грађевинског земљиште, кат. парцела број 1454/0, површине 6183 м2, са делом 	постојећег 	објекта у изградњи: млекара, прерада млека и млечних производа, 	габарита, на кат. парцели број 1454 КО Делимеђе, у својини извршног дужника 	ХАМИДА ХАМИДОВИЋА, Нови Пазар, ул. Иве Андрића бр. 25, ЈМБГ 	2001953784320, облик својине – приватна, са обимом удела 1/1",https://eaukcija.sud.rs/#/aukcije/132544
2025-05-28,True,Врање-град,10000.0,20000.0,50.0,Pokretnosti,Покретне ствари,Eлектрични шпорет марке Gorenje  бело црне боје комада 1,https://eaukcija.sud.rs/#/aukcije/132555
2025-05-28,True,Врање-град,3000.0,6000.0,50.0,Pokretnosti,Покретне ствари,Тв комода са стакленим делом  комада 1,https://eaukcija.sud.rs/#/aukcije/132556
2025-05-28,True,Врање-град,6000.0,12000.0,50.0,Pokretnosti,Покретне ствари,Две фотеље беж боје,https://eaukcija.sud.rs/#/aukcije/132557
2025-05-28,True,Врање-град,15000.0,30000.0,50.0,Pokretnosti,Покретне ствари,Кухиња са елементима  црно сиве боје,https://eaukcija.sud.rs/#/aukcije/132558
2025-05-28,True,Врање-град,6000.0,12000.0,50.0,Pokretnosti,Покретне ствари,Двосед комада 1,https://eaukcija.sud.rs/#/aukcije/132559
2025-05-28,True,Врање-град,5500.0,11000.0,50.0,Pokretnosti,Покретне ствари,Машина за судове марке Quadro ознаке:  DW – S4551 Silver комада 1,https://eaukcija.sud.rs/#/aukcije/132560
2025-05-28,True,Врање-град,9000.0,18000.0,50.0,Pokretnosti,Покретне ствари,Телевизор марке Fox led tv  модел  50le468 црне боје комада 1,https://eaukcija.sud.rs/#/aukcije/132561
2025-05-28,False,Блаце,30158.8,43084.0,70.0,Nepokretnosti,Пољопривредно земљиште,"пољопривредно земљиште, њива 3. класе, површине 1149м2, потес Село, кат. парцела бр. 497, број дела 1, уписано у лист непокретности број 321, К.О. Доњи Кашевар, Општина Блаце, у приватној својини извршног дужника Љубиша Степановић из Блаца, Кашевар бб, ЈМБГ 0101979781076 са обимом удела 1/1",https://eaukcija.sud.rs/#/aukcije/132562
2025-05-28,False,Блаце,53515.0,76450.0,70.0,Nepokretnosti,Пољопривредно земљиште,"пољопривредно земљиште, њива 3. класе, површине 2042м2, потес Село, кат. парцела бр. 498, број дела 1, уписано у лист непокретности број 321, К.О. Доњи Кашевар, Општина Блаце, у приватној својини извршног дужника Љубиша Степановић из Блаца, Кашевар бб, ЈМБГ 0101979781076 са обимом удела 1/1",https://eaukcija.sud.rs/#/aukcije/132563
2025-05-28,False,Блаце,5245.1,7493.0,70.0,Nepokretnosti,Пољопривредно земљиште,"пољопривредно земљиште, њива 3. класе, површине 4605м2, потес Село, кат. парцела бр. 501/1, број дела 1, уписано у лист непокретности број 330, К.О. Доњи Кашевар, Општина Блаце, у приватној својини извршног дужника Љубиша Степановић из Блаца, Кашевар бб, ЈМБГ 0101979781076 са обимом удела 200/4605",https://eaukcija.sud.rs/#/aukcije/132564
2025-05-28,False,Бачка Топола,98364.0,140520.0,70.0,Nepokretnosti,Непокретности,"- Катастарска парцела 6219, површине: 449м2, потес: Краља Милутина ,  ГРАДСКО ГРАЂЕВИНСКО ЗЕМЉИШТЕ, 
- Помоћна зграда, катастарска парцела 6219,  површине : 29 м2, потес: Краља Милутина, број објекта 1, КО Бачка Топола- град,
уписано у лист непокретности број 2036 КО Бачка Топола – град , општина Бачка Топола, у приватној својини извршног дужника Чила Бољановић, Бачка Топола, ул. Ружа бр. 7, обиму удела 60/100.
Напомена: предметна парцела на којој се налази  помоћна зграда нема приступ са улице. У листу непокретности у теретима уписано је право коришћења у корист свагдашњег власника  породичне стабмене зграде на парцели бр 6218 
",https://eaukcija.sud.rs/#/aukcije/132565
2025-05-28,False,Тутин,160455.97,229222.82,70.0,Nepokretnosti,Грађевинско земљиште,"Остало вештачки створено неплодно земљиште, земљиште у грађевинском подручју, на кат. парцели бр.488/2, површине 281 м2, облик својине – приватна, са обимом удела 1/1, процењене вредности",https://eaukcija.sud.rs/#/aukcije/132572
2025-05-28,True,Тутин,110636.8,221273.6,50.0,Nepokretnosti,Пољопривредно земљиште,"Ливада 6. класе, врста земљишта: пољопривредно земљиште, број дела парцеле 1, лист непокретности 152, KO Чаровина, Општина Тутин, парцела број 191, површине 1888м2, у својини извршног дужника: ЕНЕСА КУРТАНОВИЋА, Нови Пазар, ул. Побрђе бб, ЈМБГ 2105993784005, облик својине – приватна, са обимом удела 1/1,",https://eaukcija.sud.rs/#/aukcije/132573
2025-05-28,False,Врање-град,7000.0,10000.0,70.0,Pokretnosti,Покретне ствари,Кухиња са елементима,https://eaukcija.sud.rs/#/aukcije/132575
2025-05-28,False,Врање-град,8400.0,12000.0,70.0,Pokretnosti,Покретне ствари,Електрични шпорет комбиновани,https://eaukcija.sud.rs/#/aukcije/132576
2025-05-28,False,Врање-град,5600.0,8000.0,70.0,Pokretnosti,Покретне ствари,Вишеделна комода за телевизор ,https://eaukcija.sud.rs/#/aukcije/132577
2025-05-28,False,Врање-град,7000.0,10000.0,70.0,Pokretnosti,Покретне ствари,Регал спаваће собе са огледалом ,https://eaukcija.sud.rs/#/aukcije/132578
2025-05-28,False,Врање-град,12600.0,18000.0,70.0,Pokretnosti,Покретне ствари,Тросед  и две фотеље,https://eaukcija.sud.rs/#/aukcije/132579
2025-05-28,False,Врање-град,2100.0,3000.0,70.0,Pokretnosti,Покретне ствари,Аспиратор марке Горење,https://eaukcija.sud.rs/#/aukcije/132580
2025-05-28,True,Лозница-град,12000.0,24000.0,50.0,Pokretnosti,Покретне ствари,"Телевизора марке „LAKI“, црни",https://eaukcija.sud.rs/#/aukcije/132582
2025-05-28,False,Инђија,182000.0,260000.0,70.0,Pokretnosti,Покретне ствари,"Путничко возило регистрација IN048-ED, датум важења регистрације 22.05.2025. године, марка возила RENAULT, модел возила KANGOO, број шасије VF1KCEBEF33605877, запремина мотора 1461, снага мотора 60, гориво  DIZEL, број седишта 5, број мотора K9KB702D324051, година производње 2005, број пленидбене маркице: 00124",https://eaukcija.sud.rs/#/aukcije/132583
2025-05-28,False,Врњачка Бања,4200.0,6000.0,70.0,Pokretnosti,Намештај,Клуб сто браон боје,https://eaukcija.sud.rs/#/aukcije/132602
2025-05-28,False,Врњачка Бања,5600.0,8000.0,70.0,Pokretnosti,Намештај,Радни сто светло браон боје,https://eaukcija.sud.rs/#/aukcije/132603
2025-05-28,False,Врњачка Бања,8400.0,12000.0,70.0,Pokretnosti,Намештај,Орман браон боје-мост-,https://eaukcija.sud.rs/#/aukcije/132604
2025-05-28,False,Врњачка Бања,7000.0,10000.0,70.0,Pokretnosti,Намештај,Орман браон боје,https://eaukcija.sud.rs/#/aukcije/132605
2025-05-28,False,Врњачка Бања,2800.0,4000.0,70.0,Pokretnosti,Намештај,Фотеља беж боје,https://eaukcija.sud.rs/#/aukcije/132606
2025-05-28,True,Лесковац-град,100000.0,200000.0,50.0,Pokretnosti,Возило или део возила,"Теретно возило марке ŠKODA, тип PRAKTIK, година производње 2007, рег.ознаке LE189-PB, бр. шасије TMBTHB5J985018966, радне запремине 1198 cm3, снаге 51 kw, регистровано за учешће у саобраћају до 07.05.2025. године",https://eaukcija.sud.rs/#/aukcije/132608
2025-05-28,True,Бајина Башта,5000.0,10000.0,50.0,Pokretnosti,Покретне ствари,"црне боје, величина екрана 32“, пописна маркица бр. 001080",https://eaukcija.sud.rs/#/aukcije/132615
2025-05-28,False,Нови Сад - град,22062063.93,31517234.19,70.0,Nepokretnosti,Посебан део објекта,"четвороипособног стана број 10, површине 130м2, који се налази на четвртом спрату стамбене зграде за колективно становање, у улици Београдски кеј бр. 31, број објекта 1, број улаза 33, евид. бр. 8, саграђен на парцели бр. 9345/11 КО Нови Сад 1, у власништву дужника и повериоца  са уделима од ½ дела.",https://eaukcija.sud.rs/#/aukcije/132622
2025-05-28,False,Медиана,9800.0,14000.0,70.0,Pokretnosti,Покретне ствари,види слику,https://eaukcija.sud.rs/#/aukcije/132627
2025-05-28,False,Медиана,14000.0,20000.0,70.0,Pokretnosti,Машина или део машине,види слику,https://eaukcija.sud.rs/#/aukcije/132628
2025-05-28,False,Медиана,16800.0,24000.0,70.0,Pokretnosti,Покретне ствари,види слику,https://eaukcija.sud.rs/#/aukcije/132629
2025-05-28,False,Медиана,3500.0,5000.0,70.0,Pokretnosti,Покретне ствари,види слику,https://eaukcija.sud.rs/#/aukcije/132630
2025-05-28,False,Медиана,22400.0,32000.0,70.0,Pokretnosti,Покретне ствари,види слику,https://eaukcija.sud.rs/#/aukcije/132631
2025-05-28,False,Медиана,8400.0,12000.0,70.0,Pokretnosti,Покретне ствари,види слику,https://eaukcija.sud.rs/#/aukcije/132632
2025-05-28,False,Медиана,10500.0,15000.0,70.0,Pokretnosti,Покретне ствари,види слику,https://eaukcija.sud.rs/#/aukcije/132633
